{
  "$schema": "../design-definition.schema.json",
  "id": "dgdc5pnf5eizil6lxm419jil",
  "name": "Buddy Ring Duo",
  "algorithmName": "BuddyRingsDuo",
  "shortDescription": "Buddy ring duo splint for two adjacent fingers",
  "isActive": true,
  "inputParameters": [
    {
      "InputName": "c_left_mm",
      "InputDescription": "1. Left Finger Circumference (mm)",
      "InputType": "Float",
      "NumberMin": 30,
      "NumberMax": 120
    },
    {
      "InputName": "c_right_mm",
      "InputDescription": "2.Right Finger Circumference (mm)",
      "InputType": "Float",
      "NumberMin": 30,
      "NumberMax": 120
    },
    {
      "InputName": "full_perimeter_mm",
      "InputDescription": "3. Circumference of both fingers (mm). Fingers should be in natural alignment.",
      "InputType": "Float",
      "NumberMin": 70,
      "NumberMax": 250
    },
    {
      "InputName": "right_forward_offset_mm",
      "InputDescription": "4. Forward offset of right finger (mm). How far advanced should right ring be? Negative is ok.",
      "InputType": "Float",
      "NumberMin": -20,
      "NumberMax": 20
    },
    {
      "InputName": "b_left_slit",
      "InputDescription": "5. Left Ring Sizing Slit?",
      "InputType": "Boolean"
    },
    {
      "InputName": "b_right_slit",
      "InputDescription": "6. Right Ring Sizing Slit?",
      "InputType": "Boolean"
    },
    {
      "InputName": "band_width_mm",
      "InputDescription": "7. Band Width",
      "InputType": "Float",
      "NumberMin": 7.0,
      "NumberMax": 20.0
    }
  ]
}
