{
  "$schema": "../design-definition.schema.json",
  "id": "cmlljl3ha0001ju04s6szruyx",
  "name": "Infinity Flex",
  "algorithmName": "InfinityFlex",
  "shortDescription": "Used to prevent hyperextension of the PIP joint.",
  "isActive": true,
  "inputParameters": [
    {
      "InputName": "root_circumference_mm",
      "InputDescription": "1. P1 circumference (mm) at the midpoint of the proximal phalanx.",
      "InputType": "Float",
      "NumberMin": 25,
      "NumberMax": 120
    },
    {
      "InputName": "mid_circumference_mm",
      "InputDescription": "2. PIP circumference (mm)",
      "InputType": "Float",
      "NumberMin": 25,
      "NumberMax": 120
    },
    {
      "InputName": "tip_circumference_mm",
      "InputDescription": "3. P2 circumference (mm) at the midpoint of the middle phalanx.",
      "InputType": "Float",
      "NumberMin": 25,
      "NumberMax": 120
    },
    {
      "InputName": "inter_phalanx_distance_mm",
      "InputDescription": "4. Interphalangeal length (mm) - Midpoint of the proximal phalanx to midpoint of the middle phalanx.",
      "InputType": "Float",
      "NumberMin": 20,
      "NumberMax": 70
    },
    {
      "InputName": "flexion_degrees",
      "InputDescription": "5. Angle (degrees) of desired flexion from a straight position.",
      "InputType": "Float",
      "NumberMin": -45,
      "NumberMax": 45
    },
    {
      "InputName": "include_slit",
      "InputDescription": "6. Introduce a slit for fitting over a large joint.",
      "InputType": "Boolean"
    }
  ]
}
