{
  "$schema": "../design-definition.schema.json",
  "id": "cmlslk6ji0001jr04m39zgbg0",
  "name": "Infinity Extend Contracture",
  "algorithmName": "InfinityExtend",
  "shortDescription": "Used to create a sequence of splints that gradually straightens the PIP joint.",
  "isActive": true,
  "inputParameters": [
    {
      "InputName": "root_circumference_mm",
      "InputDescription": "1. P1 circumference (mm) at the midpoint of the proximal phalanx.",
      "InputType": "Float",
      "NumberMin": 25,
      "NumberMax": 120
    },
    {
      "InputName": "mid_circumference_mm",
      "InputDescription": "2. PIP circumference (mm)",
      "InputType": "Float",
      "NumberMin": 25,
      "NumberMax": 120
    },
    {
      "InputName": "tip_circumference_mm",
      "InputDescription": "3. P2 circumference (mm) at the midpoint of the middle phalanx.",
      "InputType": "Float",
      "NumberMin": 25,
      "NumberMax": 120
    },
    {
      "InputName": "inter_phalanx_distance_mm",
      "InputDescription": "4. Interphalangeal length (mm) - Midpoint of the proximal phalanx to midpoint of the middle phalanx.",
      "InputType": "Float",
      "NumberMin": 25,
      "NumberMax": 70
    },
    {
      "InputName": "contracture_flexion_start",
      "InputDescription": "5a. Contracture flexion sequence start angle (degrees) from a straight position.",
      "InputType": "Float",
      "NumberMin": -15,
      "NumberMax": 45
    },
    {
      "InputName": "contracture_flexion_end",
      "InputDescription": "5b. Contracture flexion sequence end angle (degrees) from a straight position.",
      "InputType": "Float",
      "NumberMin": -15,
      "NumberMax": 45
    },
    {
      "InputName": "contracture_flexion_count",
      "InputDescription": "Contracture flexion sequence count. This will be the number of splints printed.",
      "InputType": "Float",
      "NumberMin": 2,
      "NumberMax": 5
    }
  ]
}
